{
  "$schema": "https://json-schema.org/draft/2020-12/schema",
  "$id": "https://github.com/on-par/sound-buddy/apps/ios/Contracts/schemas/ideal-curve.v1.schema.json",
  "title": "IdealCurve v1",
  "description": "A relative, level-invariant target EQ shape. Mirrors IdealProfile in packages/audio-engine/src/profiles/index.ts so Mac-exported profiles decode on iOS unchanged. freqs and dbOffsets must be the same length and freqs strictly ascending; JSON Schema cannot express either rule, so apps/ios/scripts/validate_contracts.py and the Swift decoder enforce them.",
  "type": "object",
  "additionalProperties": false,
  "required": ["schemaVersion", "id", "label", "description", "freqs", "dbOffsets"],
  "properties": {
    "schemaVersion": {
      "description": "Contract version. Bump (and add a new schema file) on any breaking change.",
      "const": 1
    },
    "id": {
      "description": "Stable profile id, e.g. \"flat\" or \"music-fullrange\".",
      "type": "string",
      "pattern": "^[a-z0-9]+(-[a-z0-9]+)*$"
    },
    "label": { "type": "string", "minLength": 1 },
    "description": { "type": "string" },
    "freqs": {
      "description": "Grid-point center frequencies in Hz (the Mac grid is 48 log-spaced points, 20 Hz-20 kHz).",
      "type": "array",
      "minItems": 2,
      "items": { "type": "number", "exclusiveMinimum": 0 }
    },
    "dbOffsets": {
      "description": "Relative target shape in dB at each freqs point. Shape only, never absolute level.",
      "type": "array",
      "minItems": 2,
      "items": { "type": "number" }
    }
  }
}
