{
  "schemaVersion": 1,
  "id": "worship-service",
  "label": "Worship – Classic",
  "description": "Reference target captured from a full worship service mix.",
  "freqs": [
    20,
    23.166,
    26.834,
    31.083,
    36.004,
    41.704,
    48.307,
    55.955,
    64.814,
    75.075,
    86.962,
    100.73,
    116.678,
    135.15,
    156.548,
    181.333,
    210.042,
    243.297,
    281.816,
    326.434,
    378.117,
    437.981,
    507.324,
    587.645,
    680.683,
    788.451,
    913.281,
    1057.875,
    1225.361,
    1419.364,
    1644.083,
    1904.379,
    2205.887,
    2555.13,
    2959.666,
    3428.251,
    3971.022,
    4599.728,
    5327.972,
    6171.514,
    7148.608,
    8280.399,
    9591.379,
    11109.918,
    12868.877,
    14906.319,
    17266.337,
    20000
  ],
  "dbOffsets": [
    3,
    3,
    3,
    15,
    15,
    18,
    18,
    18,
    18,
    18,
    16,
    13.5,
    11,
    11.5,
    12.5,
    10.5,
    8,
    8.5,
    9,
    8,
    5.5,
    4,
    2.5,
    7,
    6.5,
    5.5,
    6,
    2,
    2,
    1,
    -1.5,
    -3,
    -6,
    -8,
    -10,
    -13.5,
    -15.5,
    -14,
    -14,
    -14.5,
    -17,
    -17,
    -17,
    -18,
    -18,
    -18,
    -18,
    -18
  ]
}
