{
  "schemaVersion": 1,
  "id": "worship-room",
  "label": "Worship – Full Band",
  "description": "Shape of a good-sounding full-band worship mix (Oct 11 2026 reference).",
  "freqs": [
    20,
    23.166,
    26.834,
    31.083,
    36.004,
    41.704,
    48.307,
    55.955,
    64.814,
    75.075,
    86.962,
    100.73,
    116.678,
    135.15,
    156.548,
    181.333,
    210.042,
    243.297,
    281.816,
    326.434,
    378.117,
    437.981,
    507.324,
    587.645,
    680.683,
    788.451,
    913.281,
    1057.875,
    1225.361,
    1419.364,
    1644.083,
    1904.379,
    2205.887,
    2555.13,
    2959.666,
    3428.251,
    3971.022,
    4599.728,
    5327.972,
    6171.514,
    7148.608,
    8280.399,
    9591.379,
    11109.918,
    12868.877,
    14906.319,
    17266.337,
    20000
  ],
  "dbOffsets": [
    -8,
    -7.5,
    -6,
    -3.5,
    -1,
    1.5,
    4,
    6.5,
    9,
    11,
    12,
    12,
    10.5,
    8.5,
    6.5,
    5.5,
    4.5,
    4,
    4,
    4.5,
    4.5,
    4.5,
    4.5,
    4.5,
    3.5,
    2.5,
    1,
    -0.5,
    -2,
    -3.5,
    -5.5,
    -7.5,
    -11,
    -13.5,
    -16.5,
    -19,
    -21,
    -22.5,
    -23.5,
    -24.5,
    -26,
    -27,
    -28.5,
    -30,
    -31.5,
    -33,
    -34.5,
    -35
  ]
}
