{
  "schemaVersion": 1,
  "id": "speech-podcast",
  "label": "Speech / podcast",
  "description": "Intelligibility: high-pass tilt, 2–5 kHz presence bump.",
  "freqs": [
    20,
    23.166,
    26.834,
    31.083,
    36.004,
    41.704,
    48.307,
    55.955,
    64.814,
    75.075,
    86.962,
    100.73,
    116.678,
    135.15,
    156.548,
    181.333,
    210.042,
    243.297,
    281.816,
    326.434,
    378.117,
    437.981,
    507.324,
    587.645,
    680.683,
    788.451,
    913.281,
    1057.875,
    1225.361,
    1419.364,
    1644.083,
    1904.379,
    2205.887,
    2555.13,
    2959.666,
    3428.251,
    3971.022,
    4599.728,
    5327.972,
    6171.514,
    7148.608,
    8280.399,
    9591.379,
    11109.918,
    12868.877,
    14906.319,
    17266.337,
    20000
  ],
  "dbOffsets": [
    -6,
    -6,
    -6,
    -6,
    -6,
    -6,
    -5.9,
    -5.63,
    -5.21,
    -4.68,
    -4.07,
    -3.41,
    -2.73,
    -2.06,
    -1.44,
    -0.89,
    -0.44,
    -0.13,
    0.01,
    0.02,
    0.05,
    0.08,
    0.15,
    0.25,
    0.41,
    0.62,
    0.92,
    1.29,
    1.74,
    2.23,
    2.75,
    3.23,
    3.63,
    3.89,
    4,
    3.93,
    3.69,
    3.26,
    2.66,
    1.96,
    1.23,
    0.52,
    -0.13,
    -0.7,
    -1.16,
    -1.52,
    -1.77,
    -1.9
  ]
}
