{
  "schemaVersion": 1,
  "id": "music-fullrange",
  "label": "Music – Balanced",
  "description": "Balanced mix: gentle low warmth and a soft presence lift.",
  "freqs": [
    20,
    23.166,
    26.834,
    31.083,
    36.004,
    41.704,
    48.307,
    55.955,
    64.814,
    75.075,
    86.962,
    100.73,
    116.678,
    135.15,
    156.548,
    181.333,
    210.042,
    243.297,
    281.816,
    326.434,
    378.117,
    437.981,
    507.324,
    587.645,
    680.683,
    788.451,
    913.281,
    1057.875,
    1225.361,
    1419.364,
    1644.083,
    1904.379,
    2205.887,
    2555.13,
    2959.666,
    3428.251,
    3971.022,
    4599.728,
    5327.972,
    6171.514,
    7148.608,
    8280.399,
    9591.379,
    11109.918,
    12868.877,
    14906.319,
    17266.337,
    20000
  ],
  "dbOffsets": [
    3,
    3,
    3,
    3,
    3,
    3,
    2.97,
    2.85,
    2.68,
    2.45,
    2.17,
    1.88,
    1.56,
    1.24,
    0.94,
    0.65,
    0.41,
    0.21,
    0.07,
    0.01,
    0.01,
    0.02,
    0.04,
    0.07,
    0.12,
    0.18,
    0.28,
    0.41,
    0.58,
    0.8,
    1.05,
    1.32,
    1.61,
    1.9,
    2.15,
    2.35,
    2.47,
    2.5,
    2.44,
    2.25,
    1.94,
    1.53,
    1.07,
    0.59,
    0.12,
    -0.31,
    -0.68,
    -0.99
  ]
}
